researcher_name,profile_url,google_scholar_id,affiliation,researcher_total_citations,researcher_keywords,researcher_homepage,paper_abstract,ai_generated_keywords,ai_generated_summary,x,y,embedding_array
Taesoo Kim,https://scholar.google.com/citations?user=06hgT8gAAAAJ&hl=en,06hgT8gAAAAJ,Georgia Institute of Technology,12306,"Security, Operating System, Systems",https://taesoo.kim/,"Recently, hybrid fuzzing has been proposed to address the limitations of fuzzing and concolic execution by combining both approaches. The hybrid approach has shown its effectiveness in various synthetic benchmarks such as DARPA Cyber Grand Challenge (CGC) binaries, but it still suffers from scaling to find bugs in complex, realworld software. We observed that the performance bottleneck of the existing concolic executor is the main limiting factor for its adoption beyond a small-scale study. To overcome this problem, we design a fast concolic execution engine, called QSYM, to support hybrid fuzzing. The key idea is to tightly integrate the symbolic emulation with the native execution using dynamic binary translation, making it possible to implement more fine-grained, so faster, instruction-level symbolic emulation. Additionally, QSYM loosens the strict soundness requirements of conventional concolic executors for better performance, yet takes advantage of a faster fuzzer for validation, providing unprecedented opportunities for performance optimizations, eg, optimistically solving constraints and pruning uninteresting basic blocks. Our evaluation shows that QSYM does not just outperform state-of-the-art fuzzers (ie, found 14× more bugs than VUzzer in the LAVA-M dataset, and outperformed Driller in 104 binaries out of 126), but also found 13 previously unknown security bugs in eight real-world programs like Dropbox Lepton, ffmpeg, and OpenJPEG, which have already been intensively tested by the stateof-the-art fuzzers, AFL and OSS-Fuzz.","Security, Operating System, Systems, Software Fuzzing, Concolic and Hybrid Symbolic Execution, Trusted Execution Environments (SGX), Cache Side-Channel Attacks & Rowhammer, Control-Flow Integrity, Memory Safety & Exploit Mitigations, Persistent Memory File Systems",Error generating summary,22.497198,-4.79346,"[-0.5869140625, -0.151123046875, 0.2144775390625, -0.423828125, 0.12890625, 0.049560546875, 0.3310546875, 0.22265625, 0.068359375, -0.0845947265625, 0.078125, -0.281494140625, 0.44384765625, 0.0279541015625, -0.021240234375, 0.05023193359375, 0.13330078125, 0.3515625, -0.066650390625, 0.07928466796875, 0.1494140625, -0.33251953125, -0.1507568359375, -0.498046875, -0.01824951171875, 0.5146484375, -0.326416015625, -0.1883544921875, -0.4951171875, -1.94140625, -0.1806640625, -0.357421875, 0.27099609375, -0.42529296875, -0.08319091796875, -0.366455078125, -0.17333984375, 0.287109375, -0.25927734375, 0.2174072265625, 0.2301025390625, 0.451171875, -0.28125, -0.292724609375, -0.292724609375, -0.56640625, -0.28369140625, -0.1658935546875, 0.0474853515625, -0.20166015625, 0.0206451416015625, 0.072998046875, 0.247802734375, 0.280517578125, 0.1556396484375, -0.1055908203125, 0.6181640625, 0.36572265625, 0.23681640625, 0.18212890625, 0.375732421875, 0.256591796875, -1.197265625, 0.45556640625, 0.58251953125, 0.265625, -0.224853515625, -0.2484130859375, 0.3203125, 0.234375, -0.58203125, 0.5302734375, 0.07830810546875, 0.65869140625, 0.176025390625, -0.016265869140625, -0.1273193359375, -0.153076171875, -0.19921875, 0.0849609375, -0.1119384765625, -0.43310546875, -0.2064208984375, -0.060150146484375, -0.46484375, -0.197998046875, -0.03460693359375, 0.0732421875, 0.6025390625, -0.1048583984375, -0.29833984375, 0.025848388671875, 0.22412109375, 0.197021484375, -0.150146484375, 0.0927734375, 0.2587890625, 0.19287109375, -0.64208984375, 2.046875, -0.3466796875, 0.05426025390625, 0.19189453125, -0.248046875, 0.5302734375, -0.2099609375, 0.06939697265625, -0.270263671875, -0.156494140625, -0.1435546875, 0.1417236328125, -0.31201171875, 0.423828125, -0.256591796875, 0.467041015625, 0.19580078125, 0.29833984375, 0.00888824462890625, -0.07421875, 0.1192626953125, -0.0867919921875, 0.254638671875, 0.30078125, -0.10760498046875, 0.3017578125, -0.5595703125, 0.289794921875, 1.0625, 0.1104736328125, 0.0853271484375, 0.165283203125, -0.21923828125, -0.131103515625, -0.198974609375, 0.059051513671875, 0.40478515625, -0.318359375, 0.05078125, 0.307861328125, -0.431640625, -0.5380859375, -0.27294921875, 0.4169921875, -0.6875, -0.2379150390625, 0.7060546875, -0.1182861328125, 0.4111328125, -0.44970703125, -0.0830078125, -0.172607421875, 0.141845703125, -0.2427978515625, -0.2880859375, 0.143798828125, 0.147216796875, 0.177001953125, 0.66650390625, -0.36328125, 0.0814208984375, -0.208984375, -0.271484375, -0.394287109375, 1.013671875, 0.09619140625, -0.6787109375, -0.0731201171875, 0.268310546875, 0.0831298828125, -0.25830078125, 0.00601959228515625, 0.145263671875, -0.088623046875, -0.25927734375, 0.2235107421875, -0.0010986328125, -0.337890625, -0.07098388671875, -0.105224609375, 0.1846923828125, 0.4892578125, -0.30078125, -0.444580078125, 0.271728515625, 0.361572265625, -0.47900390625, -0.1484375, -0.03515625, 0.1165771484375, 0.42578125, -0.6650390625, 0.2939453125, -0.3779296875, -0.1982421875, -0.2041015625, -0.26318359375, -0.159912109375, -0.02081298828125, -0.10260009765625, -0.27392578125, 0.489990234375, 0.15478515625, -0.34228515625, 0.229736328125, -0.11474609375, 0.06591796875, -0.235595703125, -0.2264404296875, 0.11602783203125, 0.4580078125, -0.20751953125, 0.0517578125, 0.32861328125, 0.0225830078125, -0.322265625, -0.005634307861328125, -0.03802490234375, 0.3857421875, 0.302734375, 0.2705078125, 0.33056640625, -0.281494140625, -0.359375, -2.1015625, -0.172119140625, -0.23486328125, -0.353515625, 0.4365234375, -0.3896484375, 0.204345703125, -0.34619140625, 0.158447265625, 0.01206207275390625, 0.443359375, -0.1875, -0.29443359375, 0.293701171875, -0.1029052734375, 0.498046875, 0.181640625, 0.113525390625, -0.226318359375, 0.0386962890625, -0.12249755859375, 0.12939453125, -0.1416015625, -0.5107421875, 0.3701171875, 0.0576171875, 1.7939453125, 0.26806640625, 0.45556640625, -0.361328125, 0.36328125, 0.1015625, -0.095947265625, -0.9208984375, 0.479248046875, 0.43701171875, 0.324462890625, 0.05084228515625, 0.143310546875, -0.134033203125, -0.353271484375, 0.2939453125, -0.0887451171875, -0.8310546875, -0.0958251953125, -0.437744140625, -0.14208984375, -0.0297698974609375, -0.13525390625, 0.1676025390625, 0.211669921875, -0.23583984375, 0.4169921875, 0.291015625, 0.154541015625, -0.474609375, -0.4033203125, 0.310546875, -0.05322265625, 0.48486328125, 0.0894775390625, -0.465576171875, -0.006076812744140625, -0.388916015625, 0.5888671875, -0.200439453125, -0.1383056640625, -0.306640625, 0.293212890625, -0.379638671875, -0.20458984375, 0.787109375, -0.224609375, -0.521484375, 0.48681640625, 0.26611328125, 0.34033203125, -0.1513671875, -0.2010498046875, -0.4091796875, 0.560546875, -0.08172607421875, 0.35107421875, 0.1983642578125, 0.0872802734375, 0.0882568359375, 0.46923828125, 0.1676025390625, 0.322265625, -0.50439453125, 0.078369140625, 0.0291748046875, -0.397705078125, -0.34033203125, 0.319580078125, 0.0748291015625, -2.525390625, 0.0421142578125, -0.001220703125, 0.1864013671875, -0.27978515625, 0.08258056640625, 0.5263671875, 0.07452392578125, -0.587890625, 0.271240234375, -0.05523681640625, 0.4365234375, 0.208984375, -0.201171875, 0.036895751953125, 0.2861328125, 0.69482421875, -0.352783203125, 0.24560546875, -0.39453125, 0.03857421875, 0.27099609375, 2.0234375, -0.019439697265625, -0.016265869140625, 0.11083984375, -0.015472412109375, 0.607421875, 0.31201171875, 0.0011844635009765625, 0.351806640625, -0.1495361328125, 0.424560546875, -0.4150390625, -0.03314208984375, 0.345458984375, -0.12420654296875, 0.37255859375, 0.2978515625, 0.04156494140625, -0.204345703125, 0.045654296875, -0.337890625, -0.1583251953125, 0.59375, -0.408203125, -0.3095703125, -0.388671875, 0.33447265625, 0.25390625, -0.185791015625, -0.1500244140625, -0.144775390625, -0.04473876953125, 0.44140625, 0.17138671875, -0.56201171875, -0.323486328125, -0.580078125, -0.1224365234375, 0.17724609375, -0.18798828125, 0.075927734375, 0.311279296875, 0.0687255859375]"
Brendan D. Saltaformaggio,https://scholar.google.com/citations?user=1GsJvtwAAAAJ&hl=en,1GsJvtwAAAAJ,"Associate Professor, Georgia Institute of Technology",1883,"Cyber Forensics, Systems Security, Malware Analysis",https://saltaformaggio.ece.gatech.edu/,"Package managers have become a vital part of the modern software development process. They allow developers to reuse third-party code, share their own code, minimize their codebase, and simplify the build process. However, recent reports showed that package managers have been abused by attackers to distribute malware, posing significant security risks to developers and end-users. For example, eslint-scope, a package with millions of weekly downloads in Npm, was compromised to steal credentials from developers. To understand the security gaps and the misplaced trust that make recent supply chain attacks possible, we propose a comparative framework to qualitatively assess the functional and security features of package managers for interpreted languages. Based on qualitative assessment, we apply well-known program analysis techniques such as metadata, static, and dynamic analysis to study registry abuse. Our initial efforts found 339 new malicious packages that we reported to the registries for removal. The package manager maintainers confirmed 278 (82%) from the 339 reported packages where three of them had more than 100,000 downloads. For these packages we were issued official CVE numbers to help expedite the removal of these packages from infected victims. We outline the challenges of tailoring program analysis tools to interpreted languages and release our pipeline as a reference point for the community to build on and help in securing the software supply chain.","Cyber Forensics, Systems Security, Malware Analysis, Memory Forensics, Android Forensics, Software Supply Chain Security, Package Manager Attacks, Log-based Attack Reconstruction, Symbolic Root Cause Analysis, Web Application/CMS Abuse","## Overview
Brendan D. Saltaformaggio is an **Associate Professor** in the School of Electrical and Computer Engineering at the **Georgia Institute of Technology**, where he leads a research group within the ECE department focused on systems- and evidence-driven security research. His work centers on **cyber forensics**, **systems security**, and **malware analysis**, with an emphasis on building tools and methodologies that help defenders and investigators reason about complex, real-world attacks. In particular, his group advances techniques for *memory forensics*, *log-based attack reconstruction*, and *supply-chain and software ecosystem security*, addressing challenges that span from low-level binary instrumentation to large-scale empirical measurement. Key technical themes in his work include <u>attack provenance and reconstruction</u>, <u>automated root-cause analysis</u>, and <u>abuse of web and package ecosystems</u>.

---

## Research Areas
Saltaformaggio’s research spans the intersection of systems research and applied security. He has developed methods for reconstructing multi-stage attacks from dispersed telemetry (e.g., the graph-based reconstruction techniques in ""Hercule""), and advanced the state of the art in memory forensics and binary analysis (work on GUI and photographic evidence recovery from memory images, RetroScope-style screen recovery, and platform-agnostic binary rewriters like RevARM). He studies the privacy and information-leakage risks of mobile systems, including traffic-analysis attacks that infer fine-grained app activities over encrypted channels, and device-wide user-activity sequencing from Android memory images. His recent and highly cited work investigates ecosystem-level threats: empirical measurement and characterization of _supply-chain attacks against package managers_, large-scale studies of malicious plugins and web-app abuse used by malware, and automated remediation techniques for vulnerable open-source components embedded in application binaries. Across these threads, he emphasizes practical systems that scale to real-world workloads and support forensic investigation and incident response.

## Notable Works
- ""Towards Measuring Supply Chain Attacks on Package Managers for Interpreted Languages"" (2021, 255 citations) — A large-scale empirical study that quantified how package managers are abused by adversaries, demonstrating attack patterns and proposing measurement methodologies to detect and mitigate supply-chain compromises in language ecosystems.  
- ""Hercule: Attack story reconstruction via community discovery on correlated log graph"" (2016, 248 citations) — Introduced a correlated-log-graph approach to stitch dispersed log footprints into coherent multi-stage attack narratives, enabling automated attack-story reconstruction for intrusion analysis.  
- ""Eavesdropping on Fine-Grained User Activities Within Smartphone Apps Over Encrypted Network Traffic"" (2016, 148 citations) — Demonstrated that passive observers can infer fine-grained in-app user actions from encrypted network traffic, exposing privacy risks in modern mobile apps and motivating countermeasures for sensitive application flows.

## Academic Background
Brendan Saltaformaggio completed advanced graduate training in computing and has established a research program at Georgia Tech that bridges systems engineering and digital forensics. His publications appear in top security and systems venues and collectively have accrued over **1,855** citations, reflecting broad impact across academia and practice. His work has been supported through collaborations with industry partners and by competitive research funding, and he regularly mentors graduate students and postdoctoral researchers who pursue forensic, malware, and systems-security topics. He is an active member of the security research community, contributing tools, datasets, and empirical studies that have informed defenses against supply-chain compromise, mobile- and cloud-based abuse, and stealthy multi-stage attacks.",22.083635,-4.164362,"[-0.52734375, -0.0938720703125, 0.203125, -0.466796875, 0.34228515625, 0.05462646484375, 0.3916015625, 0.18603515625, 0.05352783203125, -0.166748046875, 0.067626953125, -0.130126953125, 0.4482421875, 0.220703125, 0.0560302734375, -0.0823974609375, 0.0660400390625, 0.27685546875, -0.07110595703125, 0.11419677734375, 0.2392578125, -0.35107421875, -0.0064544677734375, -0.5048828125, 0.1607666015625, 0.34228515625, -0.328369140625, -0.1607666015625, -0.56640625, -1.7451171875, -0.09771728515625, -0.369140625, 0.33984375, -0.34375, 0.05438232421875, -0.2373046875, -0.268310546875, 0.36962890625, -0.09716796875, 0.3173828125, 0.15771484375, 0.402099609375, -0.173828125, -0.34423828125, -0.52392578125, -0.59375, -0.122314453125, -0.0634765625, -0.01727294921875, -0.404296875, 0.024566650390625, -0.1312255859375, 0.303466796875, 0.388916015625, 0.0408935546875, -0.09271240234375, 0.6708984375, 0.419921875, 0.424072265625, 0.31201171875, 0.34912109375, 0.23974609375, -1.4013671875, 0.54833984375, 0.513671875, 0.37158203125, -0.310791015625, -0.260009765625, 0.37109375, 0.2802734375, -0.5341796875, 0.39013671875, -0.030517578125, 0.467041015625, 0.12322998046875, 0.02947998046875, -0.1390380859375, -0.181396484375, -0.1864013671875, -0.0771484375, -0.08648681640625, -0.34765625, -0.258056640625, 0.25244140625, -0.2109375, -0.306396484375, 0.063720703125, -0.004180908203125, 0.52978515625, -0.073486328125, -0.204345703125, 0.04852294921875, 0.1497802734375, 0.1221923828125, -0.419921875, 0.032989501953125, 0.1416015625, 0.2281494140625, -0.57421875, 2.12890625, -0.43212890625, -0.04315185546875, 0.1734619140625, -0.29296875, 0.42041015625, -0.2105712890625, -0.0263671875, -0.4150390625, -0.0789794921875, 0.0323486328125, 0.17626953125, -0.143798828125, 0.340087890625, -0.3505859375, 0.552734375, 0.1640625, 0.442626953125, 0.087646484375, -0.06689453125, 0.027862548828125, -0.0176849365234375, 0.13818359375, 0.330810546875, -0.23193359375, 0.2193603515625, -0.53076171875, 0.08551025390625, 1.1875, 0.163330078125, 0.007568359375, 0.06048583984375, -0.26123046875, -0.2080078125, -0.08740234375, 0.207275390625, 0.38427734375, -0.014923095703125, 0.01959228515625, 0.224609375, -0.1787109375, -0.70458984375, -0.420166015625, 0.26513671875, -0.6298828125, -0.365234375, 0.8974609375, -0.127197265625, 0.26904296875, -0.5849609375, -0.0916748046875, -0.151611328125, 0.3134765625, -0.2119140625, -0.2186279296875, 0.176513671875, 0.1080322265625, 0.393798828125, 0.56640625, -0.31103515625, 0.1024169921875, -0.10577392578125, -0.2440185546875, -0.338623046875, 1.03125, 0.210693359375, -0.7021484375, 0.0860595703125, 0.1727294921875, 0.04052734375, -0.233154296875, 0.2008056640625, 0.28173828125, -0.187744140625, -0.15283203125, 0.1241455078125, -0.1011962890625, -0.3837890625, -0.036865234375, -0.12066650390625, 0.2291259765625, 0.3212890625, -0.42578125, -0.578125, 0.31005859375, 0.434814453125, -0.48876953125, -0.186767578125, -0.100830078125, 0.2099609375, 0.4228515625, -0.5078125, 0.197265625, -0.35986328125, -0.2802734375, -0.1768798828125, -0.157470703125, -0.221435546875, -0.0202178955078125, -0.085205078125, -0.322265625, 0.513671875, 0.0740966796875, -0.396240234375, 0.1279296875, 0.018768310546875, 0.38427734375, -0.18359375, -0.229248046875, -0.0005822181701660156, 0.33984375, -0.141357421875, 0.027923583984375, 0.3994140625, -0.12548828125, -0.1790771484375, -0.202880859375, 0.0240478515625, 0.49755859375, 0.322265625, 0.24609375, 0.1129150390625, -0.3212890625, -0.359375, -2.0625, -0.287109375, -0.1331787109375, -0.2255859375, 0.3193359375, -0.373291015625, 0.234375, -0.4111328125, 0.46728515625, 0.179931640625, 0.494140625, -0.1610107421875, -0.249755859375, 0.30908203125, -0.0843505859375, 0.44580078125, 0.25537109375, 0.146484375, -0.35400390625, 0.05181884765625, -0.180419921875, -0.0419921875, -0.02093505859375, -0.5498046875, 0.296875, 0.14013671875, 1.88671875, 0.552734375, 0.183837890625, -0.33935546875, 0.19140625, 0.15234375, -0.1046142578125, -1.1005859375, 0.4072265625, 0.2265625, 0.2939453125, -0.1259765625, -0.03204345703125, 0.0090789794921875, -0.521484375, 0.2890625, -0.015533447265625, -0.787109375, -0.12060546875, -0.271728515625, -0.31396484375, -0.12408447265625, -0.118408203125, 0.291015625, 0.1708984375, -0.1324462890625, 0.44384765625, 0.2393798828125, 0.030853271484375, -0.390625, -0.46142578125, 0.331298828125, -0.15625, 0.3115234375, -0.13330078125, -0.426513671875, 0.021087646484375, -0.658203125, 0.60693359375, -0.10687255859375, -0.0301513671875, -0.335205078125, 0.15966796875, -0.46044921875, -0.11102294921875, 0.8701171875, -0.158447265625, -0.246826171875, 0.44580078125, 0.27685546875, 0.36376953125, -0.4970703125, -0.282958984375, -0.3134765625, 0.43359375, -0.048248291015625, 0.174072265625, 0.048126220703125, 0.1556396484375, 0.206787109375, 0.52978515625, 0.08447265625, 0.33837890625, -0.509765625, -0.044952392578125, -0.05596923828125, -0.381103515625, -0.38427734375, 0.174072265625, 0.21533203125, -2.47265625, 0.226318359375, 0.007350921630859375, 0.383056640625, -0.158203125, 0.0869140625, 0.427490234375, 0.15869140625, -0.330078125, 0.12322998046875, -0.01041412353515625, 0.166748046875, 0.1346435546875, -0.179931640625, 0.1796875, 0.1927490234375, 0.60107421875, -0.47314453125, 0.294921875, -0.409423828125, 0.0002803802490234375, 0.281982421875, 2.09375, -0.157958984375, 0.1241455078125, 0.381591796875, 0.09246826171875, 0.351806640625, 0.25146484375, -0.07110595703125, 0.212158203125, -0.158203125, 0.5908203125, -0.334228515625, 0.130859375, 0.42041015625, -0.177734375, 0.305908203125, 0.26171875, -0.107177734375, -0.197509765625, 0.0007104873657226562, -0.439453125, -0.0745849609375, 0.7578125, -0.298583984375, -0.28857421875, -0.515625, 0.42626953125, 0.3505859375, -0.26171875, -0.22412109375, -0.2333984375, -0.147705078125, 0.4326171875, 0.35205078125, -0.4482421875, -0.29833984375, -0.457763671875, -0.2156982421875, 0.0718994140625, -0.16552734375, -0.0416259765625, 0.214599609375, 0.057708740234375]"
