researcher_name,profile_url,google_scholar_id,affiliation,researcher_total_citations,researcher_keywords,researcher_homepage,paper_abstract,ai_generated_keywords,ai_generated_summary,x,y,embedding_array
seth hutchinson,https://scholar.google.com/citations?user=-JPZ21IAAAAJ&hl=en,-JPZ21IAAAAJ,Northeastern University,33482,robotics,https://www.cc.gatech.edu/~seth/,"• Page 49: In the paragraph immediately before Example 2.5, change” We first rotate the frame o2x2y2z2” to” We first rotate the frame o1x1y1z1”• Page 50: In Equation (2.18) the (1, 2) element of the matrix Rz, θ should be− sθ.• Equation (2.67), page 62: The (3, 2) element of the matrix H01 should be sz.","robotics, visual servoing, robot modeling and control, motion planning, sampling-based motion planning, multi-robot coordination, active perception, visual tracking, biomimetic aerial robotics, heterogeneous multi-robot task allocation","## Overview
Seth Hutchinson is a senior researcher and professor of robotics at **Northeastern University**, leading a research group focused on advancing the theory and practice of robot perception, planning, and control. His lab bridges rigorous algorithmic development with real-world robotic systems, emphasizing **visual servoing**, **motion planning**, and multi-robot coordination. Hutchinson's work is distinguished by its blend of foundational textbooks and influential tutorials alongside applied projects (from sensing and tracking to biomimetic flight), and it consistently emphasizes <u>robust perception-to-action</u> pipelines and <u>real-time control</u> for autonomous systems. His publications and textbooks serve as canonical references in the field, and his research agenda places particular value on *principled, implementable methods* that connect theory to practice.

---

## Research Areas
Hutchinson's research spans several core areas of robotics, with sustained contributions to both theory and systems. He is best known for foundational work in **visual servo control** (e.g., ""A tutorial on visual servo control"" (2002), ""Visual servo control. I. Basic approaches"" (2006), and ""Visual servo control. II. Advanced approaches"" (2007)), which develops control laws that close the loop on image measurements for manipulation and mobile platforms. Complementing perception-driven control, he has authored influential texts on kinematics and dynamics (""Robot Modeling and Control"" (2006); ""Robot modeling and control, 2nd edition"" (2020)) and coauthored broad treatments of motion planning (""Principles of Robot Motion"" (2005)). His work also addresses multi-robot coordination and planning under uncertainty (""Optimal motion planning for multiple robots having independent goals"" (2002); ""Path planning for permutation-invariant multirobot formations"" (2006)), sensing and exploration strategies (""Planning exploration strategies for simultaneous localization and mapping"" (2006); ""Planning Sensing Strategies in a Robot Work Cell with Multi-Sensor Capabilities"" (1989)), and practical performance issues such as real-time tracking and estimator design (""Real-time vision, tracking and control"" (2000); ""Estimating uncertainty in SSD-based feature tracking"" (2002)). More recent and applied contributions include biomimetic flight platforms (""A biomimetic robotic platform to study flight specializations of bats"" (2017); ""Bat Bot (B2), a biologically inspired flying machine"" (2016)) and long-duration autonomy and task-allocation for heterogeneous teams (""Robot ecology: Constraint-based control design for long duration autonomy"" (2018); ""A resilient and energy-aware task allocation framework for heterogeneous multirobot systems"" (2021)).

## Notable Works
- ""Robot Modeling and Control"" (2006) — a widely used textbook that synthesizes kinematics, dynamics, and control for manipulators and mobile robots; it has become a standard reference for both teaching and research in robot modeling and control, and its later edition (2020) continues to influence curriculum and practice.  
- ""A tutorial on visual servo control"" (2002) — a seminal tutorial paper that established a coherent conceptual framework for image-based and position-based visual servoing, clarifying prerequisites from robotics and computer vision and guiding two decades of follow-on research.  
- ""Principles of Robot Motion: Theory, Algorithms, and Implementations"" (2005) — a comprehensive treatment of motion planning that connects rigorous theory to algorithmic implementation, widely cited for its role in making planning algorithms accessible and practical for robotic systems.

## Academic Background
Seth Hutchinson has a multi-decade academic career with research and teaching roles spanning leading robotics institutions. Over the years he has collaborated with and published alongside researchers at the University of Illinois and Georgia Tech, and he is currently affiliated with **Northeastern University**, where he continues to supervise students and lead research projects. Hutchinson is the author and coauthor of foundational textbooks and highly cited tutorials that have shaped robotics education and research; his work has accrued over 33,000 citations, reflecting broad influence across control, perception, planning, and multirobot systems. His publication record (from early work on sensing strategies and planning in the late 1980s and 1990s to recent contributions on robotic grasping and long-duration autonomy) demonstrates a sustained impact on both theoretical foundations and real-world robotic applications.",22.067701,-2.8780332,"[-0.352294921875, -0.43798828125, 0.26318359375, -0.208740234375, 0.03521728515625, 0.37060546875, 0.3076171875, 0.3720703125, 0.0192718505859375, 0.22216796875, 0.2412109375, -0.6376953125, 0.2734375, 0.70849609375, -0.0246734619140625, 0.169189453125, -0.2353515625, 0.409423828125, 0.00494384765625, 0.127197265625, 0.31494140625, -0.341796875, -0.14794921875, -0.3876953125, -0.0823974609375, 0.470947265625, -0.431640625, -0.27001953125, -0.162841796875, -1.84375, -0.038818359375, -0.41552734375, 0.44189453125, -0.26513671875, -0.04290771484375, -0.05389404296875, -0.4189453125, 0.42822265625, -0.124755859375, 0.29443359375, 0.27001953125, 0.0153656005859375, -0.187744140625, -0.6279296875, -0.26171875, -0.4189453125, -0.198974609375, -0.199462890625, -0.05609130859375, -0.43017578125, -0.038604736328125, -0.44873046875, 0.2020263671875, 0.0936279296875, 0.2022705078125, 0.3154296875, 0.36474609375, 0.287841796875, 0.291015625, 0.09027099609375, 0.488525390625, 0.29052734375, -1.517578125, 0.66259765625, 0.4609375, 0.245849609375, -0.31494140625, -0.279052734375, 0.328125, 0.3408203125, -0.434326171875, 0.2486572265625, 0.017730712890625, 0.37548828125, 0.1405029296875, -0.38134765625, -0.093017578125, -0.4345703125, -0.03857421875, 0.0711669921875, -0.1033935546875, -0.237548828125, -0.351318359375, 0.0144500732421875, -0.26904296875, -0.0859375, 0.113037109375, -0.4794921875, 0.521484375, 0.197265625, -0.260009765625, 0.0888671875, -0.381103515625, 0.08624267578125, -0.578125, -0.0728759765625, 0.2783203125, 0.1669921875, -0.36865234375, 1.912109375, -0.3955078125, 0.33349609375, 0.65478515625, -0.1844482421875, 0.1787109375, -0.311279296875, -0.316650390625, -0.30712890625, -0.296630859375, 0.43115234375, -0.0050811767578125, -0.065673828125, 0.279296875, 0.074951171875, 0.054901123046875, 0.19189453125, 0.239013671875, 0.37353515625, 0.111572265625, -0.3017578125, 0.2225341796875, 0.24755859375, 0.33203125, -0.0523681640625, 0.13427734375, -0.74267578125, 0.216552734375, 1.298828125, 0.2178955078125, 0.0682373046875, 0.64208984375, -0.3193359375, -0.16943359375, -0.33935546875, 0.09588623046875, 0.28271484375, 0.202880859375, 0.0195159912109375, 0.197265625, 0.027923583984375, -0.296630859375, -0.56494140625, 0.09442138671875, -0.9482421875, -0.219970703125, 0.80419921875, -0.275390625, 0.1783447265625, -0.29638671875, -0.07470703125, -0.183349609375, 0.29296875, -0.017364501953125, -0.04241943359375, -0.0531005859375, 0.1414794921875, 0.296875, 0.498046875, -0.42333984375, 0.28076171875, -0.4990234375, -0.30712890625, -0.33837890625, 0.8154296875, 0.0968017578125, -0.74755859375, -0.2198486328125, 0.0240020751953125, -0.0211944580078125, 0.024749755859375, -0.0897216796875, 0.12176513671875, -0.221923828125, 0.07373046875, 0.7216796875, 0.183837890625, -0.70703125, 0.19677734375, -0.137939453125, 0.04974365234375, 0.3330078125, -0.4501953125, -0.038787841796875, 0.1558837890625, 0.314453125, -0.112060546875, -0.15869140625, -0.20556640625, 0.09130859375, 0.3828125, -0.0997314453125, 0.1689453125, -0.02447509765625, 0.03826904296875, -0.08526611328125, -0.151123046875, -0.1253662109375, -0.154296875, 0.1478271484375, -0.268310546875, 0.2294921875, 0.005672454833984375, -0.37939453125, 0.04925537109375, 0.0513916015625, -0.1690673828125, -0.34521484375, 0.040802001953125, 0.1455078125, 0.501953125, -0.5126953125, 0.147216796875, 0.41796875, -0.27685546875, -0.37939453125, 0.1328125, -0.036102294921875, 0.364013671875, 0.1231689453125, 0.1925048828125, 0.219970703125, -0.203857421875, -0.2626953125, -1.759765625, 0.030670166015625, -0.04205322265625, 0.06500244140625, 0.3486328125, -0.402099609375, -0.027923583984375, -0.344970703125, 0.22705078125, 0.20654296875, 0.78466796875, -0.3232421875, -0.2252197265625, 0.188232421875, -0.171875, 0.53125, 0.05572509765625, 0.13134765625, -0.39208984375, -0.1395263671875, 0.00440216064453125, 0.054229736328125, -0.026763916015625, -0.33544921875, 0.3251953125, -0.330078125, 1.779296875, 0.244140625, 0.29736328125, -0.047088623046875, 0.28857421875, 0.298828125, -0.31201171875, -0.41845703125, 0.3486328125, 0.281494140625, 0.323486328125, -0.38720703125, 0.11126708984375, -0.2568359375, -0.0985107421875, 0.041748046875, -0.0838623046875, -0.7666015625, -0.1473388671875, -0.3955078125, -0.282958984375, 0.4775390625, -0.108642578125, -0.20947265625, 0.3564453125, -0.486083984375, 0.25390625, -0.308349609375, -0.251220703125, -0.077880859375, -0.306884765625, 0.1751708984375, -0.26806640625, 0.431396484375, 0.0794677734375, -0.150146484375, 0.0584716796875, -0.3349609375, 0.6064453125, 0.0185546875, 0.04803466796875, -0.275146484375, 0.28076171875, -0.18359375, 0.1055908203125, 0.7490234375, 0.5283203125, 0.0052032470703125, 0.50634765625, -0.029510498046875, 0.15966796875, 0.0367431640625, -0.09796142578125, -0.474609375, 0.22412109375, -0.180419921875, -0.033111572265625, 0.37841796875, 0.19384765625, -0.27392578125, 0.4404296875, -0.443359375, 0.05694580078125, -0.14208984375, 0.114990234375, 0.060089111328125, -0.28515625, 0.1328125, 0.52783203125, 0.315673828125, -2.62890625, 0.291015625, 0.341552734375, 0.26953125, -0.3916015625, -0.04644775390625, 0.54248046875, -0.028167724609375, -0.29833984375, 0.07672119140625, -0.21337890625, 0.44677734375, 0.27685546875, 0.416015625, 0.171630859375, 0.13916015625, 0.40771484375, -0.298828125, 0.44873046875, -0.705078125, 0.1875, 0.228759765625, 2.02734375, -0.274658203125, 0.250244140625, 0.16162109375, -0.2939453125, -0.260498046875, -0.0068817138671875, -0.221923828125, 0.0947265625, 0.318359375, 0.76025390625, -0.47607421875, 0.242431640625, 0.70458984375, -0.16845703125, 0.361328125, -0.05975341796875, -0.03594970703125, -0.37109375, 0.0672607421875, 0.188232421875, -0.2047119140625, 0.76806640625, 0.039306640625, -0.52734375, -0.1689453125, -0.10430908203125, 0.055694580078125, -0.458740234375, -0.135498046875, -0.191650390625, -0.125732421875, 0.31494140625, 0.1943359375, -0.0850830078125, -0.38232421875, -0.6552734375, -0.30322265625, 0.21875, -0.515625, -0.1126708984375, -0.228515625, 0.07470703125]"
Neha Kumar,https://scholar.google.com/citations?user=-ZqZyP0AAAAJ&hl=en,-ZqZyP0AAAAJ,Associate Professor @Georgia Tech,6469,"Human-Computer Interaction, Health",http://www.nehakumar.org/,"We present a qualitative study of mobile communication via WeChat in Southern China, focusing on the rapid proliferation of emoji and stickers and the lessening dependence on text. We use interview and observation data from 30 participants to investigate how rural, small town, and urban Chinese adults creatively and innovatively balance the use of emoji, stickers, and text in their mobile communication practices. We also discuss design implications of our research for the field of HCI, offering ways of leveraging the non-textual communication practices that we uncover, in scenarios where purely text-based communication may not suffice.","Human-Computer Interaction,Health,HCI for Development,Digital Mental Health,Mobile and Social Media Communication,Maternal Health,Menstrual Health Education,Feminist HCI,Community Health Workers,AI and Datafication in Global Health",Error generating summary,21.0891,-4.3120236,"[-0.1004638671875, 0.2060546875, 0.245361328125, -0.122802734375, 0.1165771484375, 0.073486328125, 0.399658203125, 0.404052734375, 0.0594482421875, -0.1865234375, 0.00618743896484375, -0.40087890625, 0.40966796875, 0.34326171875, 0.147216796875, 0.2265625, -0.11553955078125, -0.04876708984375, -0.248046875, 0.373779296875, 0.05224609375, -0.1337890625, -0.075439453125, -0.509765625, 0.1668701171875, 0.07415771484375, -0.4521484375, -0.43017578125, -0.42578125, -1.32421875, 0.01262664794921875, -0.21533203125, 0.681640625, -0.05511474609375, -0.25439453125, -0.35400390625, 0.0701904296875, 0.38623046875, -0.134033203125, 0.2861328125, -0.1937255859375, -0.03399658203125, -0.04107666015625, -0.4423828125, -0.494140625, -0.490234375, -0.33447265625, 0.06396484375, -0.327392578125, -0.619140625, 0.1573486328125, -0.1629638671875, 0.2529296875, 0.27197265625, 0.3173828125, 0.1624755859375, 0.4609375, 0.27197265625, 0.36181640625, 0.448486328125, 0.62841796875, 0.2802734375, -1.7578125, 1.09765625, 0.451171875, 0.22021484375, -0.109130859375, -0.156494140625, 0.2060546875, 0.1190185546875, -0.31591796875, 0.20361328125, 0.36474609375, 0.57275390625, 0.388671875, -0.1004638671875, 0.0703125, -0.36572265625, 0.0249786376953125, -0.0228424072265625, 0.17529296875, -0.1591796875, -0.051177978515625, 0.07012939453125, -0.33935546875, -0.484375, 0.0085601806640625, -0.466796875, 0.222900390625, -0.09490966796875, -0.482421875, -0.11767578125, -0.1767578125, 0.1171875, -0.33837890625, -0.219482421875, 0.14453125, 0.255859375, -0.59619140625, 1.982421875, -0.5810546875, -0.0872802734375, 0.439697265625, -0.156494140625, 0.34716796875, -0.23291015625, -0.0870361328125, -0.56787109375, -0.006786346435546875, -0.012969970703125, -0.09283447265625, 0.01056671142578125, 0.27783203125, -0.23779296875, 0.267822265625, 0.08453369140625, 0.094482421875, 0.24267578125, 0.26025390625, -0.021514892578125, -0.2138671875, 0.16015625, 0.3408203125, -0.3740234375, 0.124267578125, -0.5341796875, 0.33203125, 1.080078125, 0.186767578125, -0.063720703125, 0.7783203125, -0.04644775390625, -0.3515625, -0.112548828125, 0.01128387451171875, -0.0164031982421875, 0.09918212890625, -0.1708984375, 0.139404296875, -0.202392578125, -0.02471923828125, -0.40673828125, -0.16943359375, -0.986328125, -0.267578125, 0.76220703125, 0.10748291015625, 0.352294921875, -0.09454345703125, 0.218017578125, 0.1973876953125, 0.0863037109375, -0.50439453125, 0.131591796875, 0.178955078125, 0.207763671875, 0.2666015625, 0.43212890625, -0.34033203125, 0.18408203125, 0.13818359375, -0.591796875, -0.468994140625, 0.86767578125, 0.1099853515625, -0.72705078125, -0.1192626953125, 0.1697998046875, 0.12286376953125, -0.1351318359375, 0.27099609375, 0.1185302734375, -0.26220703125, 0.2255859375, 0.6103515625, 0.144775390625, -0.5322265625, 0.33984375, 0.01309967041015625, 0.26611328125, 0.160888671875, -0.251953125, -0.213134765625, 0.203857421875, 0.2705078125, -0.496826171875, 0.032806396484375, -0.302734375, 0.57275390625, 0.237548828125, -0.0176544189453125, 0.287109375, -0.4365234375, -0.11279296875, -0.13134765625, -0.28173828125, -0.0003643035888671875, -0.35107421875, 0.0841064453125, -0.1590576171875, 0.0264739990234375, 0.025848388671875, -0.4150390625, 0.470703125, 0.173828125, 0.1180419921875, -0.221923828125, -0.11834716796875, 0.36962890625, 0.27587890625, -0.1724853515625, 0.26708984375, 0.8056640625, -0.234375, -0.38671875, -0.2225341796875, 0.5615234375, 0.1097412109375, 0.0467529296875, 0.5361328125, 0.0711669921875, -0.320556640625, -0.4462890625, -1.939453125, 0.04840087890625, -0.1202392578125, -0.3779296875, 0.18017578125, -0.36962890625, 0.201416015625, -0.279296875, 0.45263671875, 0.6171875, 1.009765625, -0.089111328125, -0.4013671875, 0.45849609375, -0.09979248046875, 0.0496826171875, 0.20068359375, 0.126708984375, -0.360107421875, -0.12451171875, -0.044677734375, 0.11895751953125, -0.150146484375, -0.62890625, 0.26025390625, 0.0032367706298828125, 2.015625, 0.52197265625, -0.0457763671875, -0.0017976760864257812, 0.2364501953125, 0.36865234375, -0.36328125, -1.48046875, 0.440185546875, 0.2392578125, 0.2216796875, -0.43310546875, -0.53369140625, -0.20166015625, -0.29150390625, 0.2109375, -0.04766845703125, -0.5791015625, -0.09600830078125, -0.208740234375, -0.311767578125, -0.13232421875, -0.148193359375, -0.0242767333984375, -0.20654296875, -0.3681640625, 0.0237274169921875, 0.17236328125, -0.34423828125, -0.295654296875, -0.7333984375, 0.4375, -0.279052734375, 0.17822265625, -0.25732421875, -0.28759765625, 0.0693359375, -0.54296875, 0.26318359375, -0.037353515625, -0.1468505859375, -0.0347900390625, 0.2861328125, -0.277099609375, -0.026519775390625, 0.927734375, -0.3330078125, -0.238525390625, 0.272705078125, -0.0654296875, 0.27490234375, -0.334716796875, -0.138916015625, -0.15673828125, 0.39208984375, 0.018157958984375, 0.1483154296875, 0.55615234375, 0.1129150390625, -0.021881103515625, 0.451171875, -0.21435546875, 0.2724609375, -0.4423828125, 0.0631103515625, 0.26220703125, -0.470458984375, -0.37451171875, 0.107421875, -0.157958984375, -2.345703125, 0.42041015625, -0.1240234375, 0.36474609375, -0.5791015625, 0.0020122528076171875, 0.1953125, 0.336181640625, -0.32177734375, 0.2398681640625, 0.373046875, 0.2607421875, 0.39599609375, -0.074951171875, 0.04412841796875, 0.303955078125, 0.332763671875, -0.39599609375, 0.1761474609375, -0.58642578125, 0.051300048828125, 0.245849609375, 1.5625, -0.33154296875, 0.20361328125, 0.239013671875, 0.05120849609375, -0.0124359130859375, 0.205322265625, -0.06884765625, -0.07977294921875, -0.0718994140625, 0.7939453125, 0.0423583984375, 0.27099609375, -0.0760498046875, -0.207275390625, 0.29638671875, 0.2578125, 0.12158203125, -0.2470703125, 0.21044921875, -0.243408203125, -0.1285400390625, 0.7158203125, -0.06536865234375, -0.5517578125, -0.422607421875, 0.220458984375, 0.181640625, -0.120361328125, 0.061920166015625, -0.11590576171875, 0.2939453125, 0.1630859375, 0.373779296875, -0.2120361328125, -0.2939453125, -0.460693359375, -0.383056640625, 0.1241455078125, -0.1031494140625, -0.16845703125, 0.266845703125, 0.099609375]"
